{
  "$schema": "https://json-schema.org/draft/2020-12/schema",
  "$id": "https://example.invalid/schemas/chain-definition.schema.json",
  "title": "Chain Watch Definition",
  "type": "object",
  "additionalProperties": false,
  "required": [
    "schema_version",
    "chain_id",
    "title",
    "purpose",
    "nodes",
    "links",
    "created_at",
    "sensitivity"
  ],
  "properties": {
    "schema_version": {
      "const": "0.1.0"
    },
    "chain_id": {
      "type": "string",
      "pattern": "^chn-[A-Za-z0-9._-]+$"
    },
    "title": {
      "type": "string",
      "minLength": 1
    },
    "purpose": {
      "type": "string",
      "minLength": 1
    },
    "nodes": {
      "type": "array",
      "minItems": 2,
      "items": {
        "type": "object",
        "additionalProperties": false,
        "required": [
          "node_id",
          "label",
          "description",
          "observation_domains",
          "risk_variables"
        ],
        "properties": {
          "node_id": {
            "type": "string",
            "pattern": "^chnode-[A-Za-z0-9._-]+$"
          },
          "label": {
            "type": "string",
            "minLength": 1
          },
          "description": {
            "type": "string",
            "minLength": 1
          },
          "observation_domains": {
            "type": "array",
            "uniqueItems": true,
            "items": {
              "type": "string",
              "minLength": 1
            }
          },
          "risk_variables": {
            "type": "array",
            "uniqueItems": true,
            "items": {
              "enum": [
                "A",
                "B",
                "C",
                "D"
              ]
            }
          }
        }
      }
    },
    "links": {
      "type": "array",
      "minItems": 1,
      "items": {
        "type": "object",
        "additionalProperties": false,
        "required": [
          "link_id",
          "source_node_id",
          "target_node_id",
          "mechanism",
          "required",
          "expected_latency_days",
          "persistence_note"
        ],
        "properties": {
          "link_id": {
            "type": "string",
            "pattern": "^chlink-[A-Za-z0-9._-]+$"
          },
          "source_node_id": {
            "type": "string",
            "pattern": "^chnode-[A-Za-z0-9._-]+$"
          },
          "target_node_id": {
            "type": "string",
            "pattern": "^chnode-[A-Za-z0-9._-]+$"
          },
          "mechanism": {
            "type": "string",
            "minLength": 1
          },
          "required": {
            "type": "boolean"
          },
          "expected_latency_days": {
            "oneOf": [
              {
                "type": "null"
              },
              {
                "type": "object",
                "additionalProperties": false,
                "required": [
                  "min",
                  "max"
                ],
                "properties": {
                  "min": {
                    "type": "number",
                    "minimum": 0
                  },
                  "max": {
                    "type": "number",
                    "minimum": 0
                  }
                }
              }
            ]
          },
          "persistence_note": {
            "type": [
              "string",
              "null"
            ]
          }
        }
      }
    },
    "created_at": {
      "type": "string",
      "format": "date-time"
    },
    "sensitivity": {
      "enum": [
        "public",
        "internal",
        "confidential",
        "restricted"
      ]
    }
  }
}
